destino_turistico,pais-ciudad,descripcion,link
Montmartre, Francia | París,"Tambien conocido como el “barrio de los pintores”, situado en una colina de 130 metros de...",https://www.viajerosporelmundo.com/explora-el-mundo/montmartre/
Parque de las Ciencias de Granada, España | Granada,El Parque de las Ciencias de Granada se cataloga como el primer museo interactivo de la ciencia...,https://www.viajerosporelmundo.com/explora-el-mundo/parque-ciencias-granada/
Manneken Pis, Bélgica | Bruselas,"Aunque tiene pequeñas dimensiones, apenas tiene 50 centímetros, es uno de los símbolos más...",https://www.viajerosporelmundo.com/explora-el-mundo/manneken-pis/
Casas Flotantes de Ámsterdam, Países Bajos | Ámsterdam,"Ámsterdam se caracteriza por sus canales, sus calles llenas de bicis, sus antiguos coffe shops...",https://www.viajerosporelmundo.com/explora-el-mundo/casas-flotantes-de-amsterdam/
Zaanse Schans: La ruta de los molinos, Países Bajos | Ámsterdam,"Vas a Ámsterdam y quieres conocer uno de sus secretos mejor guardados?
Pues entonces no...",https://www.viajerosporelmundo.com/explora-el-mundo/zaanse-schans-la-ruta-de-los-molinos/
Palacio Kensington, Inglaterra | Londres,"En Palacio de Kensington, en Londres, es la residencia habitual del Príncipe Guillermo, la...",https://www.viajerosporelmundo.com/explora-el-mundo/palacio-kensington/
Casa de las Cabezas, España | Córdoba,"Situada en el corazón de la ciudad de Córdoba, la Casa de las Cabezas nos sumerge en una...",https://www.viajerosporelmundo.com/explora-el-mundo/casa-de-las-cabezas/
Gorges de la Diosaz, Francia,"Nos encontramos ante uno de los senderos naturales más bellos de Francia, las Gargantas de la...",https://www.viajerosporelmundo.com/explora-el-mundo/gorges-diosaz/
Torre de Londres, Inglaterra | Londres,"La Torre de Londres, que se conoce oficialmente como Palacio real y Fortaleza de su Majestad, es...",https://www.viajerosporelmundo.com/explora-el-mundo/torre-de-londres/
Luz-Saint-Sauveur, Francia | Altos Pirineos de Francia - Hautes-Pyrénées,"Luz-Saint-Sauveur es una comuna francesa que está situada en los Altos Pirineos, en la región...",https://www.viajerosporelmundo.com/explora-el-mundo/luz-saint-sauveur/
Parque de la Ciutadella, España | Barcelona,Construido sobre los terrenos de la antigua fortaleza de la ciudad con motivo de la Exposición...,https://www.viajerosporelmundo.com/explora-el-mundo/parque-de-la-ciutadella/
Paseo de los Tristes, España | Granada,"Serpenteante entre la Alhambra y el Albaicín y bordeando los márgenes del río Darro, nos...",https://www.viajerosporelmundo.com/explora-el-mundo/paseo-tristes/
Empire State Building, EEUU | Nueva York,El Edificio Empire State (en inglés Empire State Building) ubicado entre la Quinta Avenida...,https://www.viajerosporelmundo.com/explora-el-mundo/empire-state-building/
Palacio y Parque del Cincuentenario, Bélgica | Bruselas,"El Palacio del Cincuentenario es un impresionante monumento, que junto al Parque del...",https://www.viajerosporelmundo.com/explora-el-mundo/palacio-y-parque-del-cincuentenario/
Campanile, Italia | Venecia,El Campanile es el edificio más alto de toda Venecia con sus casi 100 metros de altura. Situado...,https://www.viajerosporelmundo.com/explora-el-mundo/campanile/
Palacio Real de Madrid, España | Madrid,El Palacio Real de Madrid es la residencia oficial de la Familia Real Española. Hoy en día el...,https://www.viajerosporelmundo.com/explora-el-mundo/palacio-real-de-madrid/
Parque de El Retiro, España | Madrid,"Con 125 hectáreas y más de 15.000 árboles, el parque de El Retiro es un recodo verde en el...",https://www.viajerosporelmundo.com/explora-el-mundo/parque-de-el-retiro/
Le Lac des Chavants, Francia,"Ubicado en Les Houches, en el Valle de Chamonix y con el Macizo del Mont Blanc de fondo,...",https://www.viajerosporelmundo.com/explora-el-mundo/lac-chavants/
Coffe shops, Países Bajos | Ámsterdam,"Ámsterdam es mundialmente conocida por sus canales, sus bicis, sus museos… pero también por...",https://www.viajerosporelmundo.com/explora-el-mundo/coffe-shops/
Covent Garden, Inglaterra | Londres,"Este animado barrio londinense está ubicado en el centro de la capital, rodeado de High Holborn...",https://www.viajerosporelmundo.com/explora-el-mundo/covent-garden/
Basílica de San Pedro, Italia | Roma,La Basílica de San Pedro es el edificio religioso más importante del catolicismo. En ella el...,https://www.viajerosporelmundo.com/explora-el-mundo/basilica-de-san-pedro/
Museo del Louvre, Francia | París,"Junto con la Torre Eiffel y el Arco del Triunfo, el Museo del Louvre es uno de los atractivos...",https://www.viajerosporelmundo.com/explora-el-mundo/museo-del-louvre/
Petit Balcon Sud, Francia,"Alrededor de unos 350 kilómetros de senderos recorren el Valle de Chamonix, y más de 170 rutas...",https://www.viajerosporelmundo.com/explora-el-mundo/petit-balcon-sud/
Campo de Concentración Sachsenhausen, Alemania | Berlín,El Campo de Concentración de Sachsenhausen fue construido en 1936 por prisioneros de otros...,https://www.viajerosporelmundo.com/explora-el-mundo/campo-de-concentracion-sachsenhausen/
Plaza de la Corredera, España | Córdoba,La plaza de la Corredera es la única plaza mayor rectangular de toda Andalucía y uno de los...,https://www.viajerosporelmundo.com/explora-el-mundo/plaza-de-la-corredera/
Panteón de Agripa, Italia | Roma,"El panteón de Roma es la obra arquitectónica mejor conservada de la Antigua roma, una de las...",https://www.viajerosporelmundo.com/explora-el-mundo/panteon-agripa/
Boca de la Verdad (Bocca della Veritá), Italia | Roma,La Boca de la Verdad (Bocca della Veritá) es una gran máscara hecha en mármol pavonazzeto que...,https://www.viajerosporelmundo.com/explora-el-mundo/boca-de-la-verdad/
Plaza de las Tendillas, España | Córdoba,La Plaza de las Tendillas es el corazón de la ciudad de Córdoba y es el eje donde se...,https://www.viajerosporelmundo.com/explora-el-mundo/plaza-de-las-tendillas/
Plaza Puerta del Rincón, España | Córdoba,La plaza Puerta del Rincón se une a la lista de los encantos más fotografiados de...,https://www.viajerosporelmundo.com/explora-el-mundo/plaza-puerta-del-rincon/
La Puerta de Alcalá, España | Madrid,La puerta de Alcalá es un monumento emblemático de la ciudad de Madrid. Hace algunos años...,https://www.viajerosporelmundo.com/explora-el-mundo/la-puerta-de-alcala/
Torre de la Pólvora, República Checa | Praga,"La Torre de la Pólvora (Prašná brána) es una de las torres más famosas de Praga,...",https://www.viajerosporelmundo.com/explora-el-mundo/torre-de-la-polvora/
Puente de Carlos, República Checa | Praga,El Puente de Carlos es una de las zonas más transitadas de la ciudad. Este puente sirvió como...,https://www.viajerosporelmundo.com/explora-el-mundo/puente-de-carlos/
Argeles-Gazost, Francia | Altos Pirineos de Francia - Hautes-Pyrénées,"Su ubicación privilegiada en el corazón del Valle de los Grandes Sitios, entre Lourdes y...",https://www.viajerosporelmundo.com/explora-el-mundo/argeles-gazost/
La Puerta del Sol, España | Madrid,"La Puerta del sol es una de las plazas más famosas de Madrid, y en ella se pueden encontrar...",https://www.viajerosporelmundo.com/explora-el-mundo/la-puerta-del-sol/
Kew Gardens, Inglaterra | Londres,"El Real Jardín Botánico de Kew, conocido como Jardines de Kew (Kew Gardens) es un inmenso...",https://www.viajerosporelmundo.com/explora-el-mundo/kew-gardens/
Partenón, Grecia | Atenas,"El Partenón es, sin duda alguna, el monumento más importante y representativo no sólo de...",https://www.viajerosporelmundo.com/explora-el-mundo/partenon/
Palacio Buckingham, Inglaterra | Londres,"Como todo el mundo sabe, el palacio de Buckingham es la residencia oficial del monarca...",https://www.viajerosporelmundo.com/explora-el-mundo/palacio-buckingham/
Tate Modern, Inglaterra | Londres,Como Tate Modern se conoce al Museo Nacional Británico de Arte Moderno. Se trata del Museo de...,https://www.viajerosporelmundo.com/explora-el-mundo/tate-modern/
Estatua de Maimónides, España | Córdoba,"Nacido en Córdoba en 1135, Maimónides es considerado el principal pensador científico judío...",https://www.viajerosporelmundo.com/explora-el-mundo/estatua-de-maimonides/
Torre de la Pólvora, República Checa | Praga,"La Torre de la Pólvora (Prašná brána) es una de las torres más famosas de Praga,...",https://www.viajerosporelmundo.com/explora-el-mundo/torre-de-la-polvora/
Museo Picasso de Barcelona, España | Barcelona,El museo Picasso de Barcelona posee una colección de 4.249 obras del pintor malagueño Pablo...,https://www.viajerosporelmundo.com/explora-el-mundo/museo-picasso-de-barcelona/
St. James´ s Park, Inglaterra | Londres,"St. Jame´s Park está situado al lado del Palacio de Buckingham. Desde este parque, el más...",https://www.viajerosporelmundo.com/explora-el-mundo/st-james-s-park/
Castillo de Lourdes y Museo Pirenaico, Francia | Lourdes,"Historia del lugar
Durante la conquista de la Galia, los romanos fueron seguramente los...",https://www.viajerosporelmundo.com/explora-el-mundo/castillo-de-lourdes-y-museo-pirenaico/
Arco del Triunfo, Francia | París,"Arcos de triunfo hay muchos repartidos por toda Europa, pero probablemente el Arco del Triunfo...",https://www.viajerosporelmundo.com/explora-el-mundo/arco-del-triunfo/
Panteón de París, Francia | París,El panteón París fue el primer monumento de importancia de la capital francesa.  Su...,https://www.viajerosporelmundo.com/explora-el-mundo/panteon-de-paris/
Calleja de la Flores, España | Córdoba,"Ubicada en pleno corazón de Córdoba, la Calleja de la Flores se ha convertido en una visita...",https://www.viajerosporelmundo.com/explora-el-mundo/calleja-de-la-flores/
Clementinum, República Checa | Praga,"El Clementinum (Klementinum en checo) es, después del Castillo de Praga, el complejo más...",https://www.viajerosporelmundo.com/explora-el-mundo/clementinum/
La Plaza de San Pedro, Italia | Roma,La Plaza de San Pedro es una de las plazas más bonitas y grandes del mundo. Se encuentra...,https://www.viajerosporelmundo.com/explora-el-mundo/la-plaza-de-san-pedro/
Puente de Carlos, República Checa | Praga,El Puente de Carlos es una de las zonas más transitadas de la ciudad. Este puente sirvió como...,https://www.viajerosporelmundo.com/explora-el-mundo/puente-de-carlos/
Museo de Historia natural, Inglaterra | Londres,El Museo de Historia Natural londinense es uno de los tres museos que se hallan situados en la...,https://www.viajerosporelmundo.com/explora-el-mundo/museo-de-historia-natural/
Plaza de las Tendillas, España | Córdoba,La Plaza de las Tendillas es el corazón de la ciudad de Córdoba y es el eje donde se...,https://www.viajerosporelmundo.com/explora-el-mundo/plaza-de-las-tendillas/
Reloj Astronómico., República Checa | Praga,El Reloj Astronómico de Praga es un famoso reloj que podemos encontrar en la pared sur del...,https://www.viajerosporelmundo.com/explora-el-mundo/reloj-astronomico/
Torre de Londres, Inglaterra | Londres,"La Torre de Londres, que se conoce oficialmente como Palacio real y Fortaleza de su Majestad, es...",https://www.viajerosporelmundo.com/explora-el-mundo/torre-de-londres/
Acrópolis, Grecia | Atenas,La Acrópolis es uno de los lugares más característicos de Grecia. Su traducción literal es...,https://www.viajerosporelmundo.com/explora-el-mundo/acropolis/
Museo del Louvre, Francia | París,"Junto con la Torre Eiffel y el Arco del Triunfo, el Museo del Louvre es uno de los atractivos...",https://www.viajerosporelmundo.com/explora-el-mundo/museo-del-louvre/
Central Park, EEUU | Nueva York,"Este parque tiene un tamaño considerable, acorde al tamaño de la ciudad y se extiende por...",https://www.viajerosporelmundo.com/explora-el-mundo/central-park/
Palacio Buckingham, Inglaterra | Londres,"Como todo el mundo sabe, el palacio de Buckingham es la residencia oficial del monarca...",https://www.viajerosporelmundo.com/explora-el-mundo/palacio-buckingham/
Atomium, Bélgica | Bruselas,"El Atomium es uno de los símbolos más famosos de Bruselas. Diseñado para la Expo de 1958, fue...",https://www.viajerosporelmundo.com/explora-el-mundo/atomium/
El Parque Güell, España | Barcelona,"Es un símbolo de Barcelona. El parque Güell, una de las obras más emblemáticas de Gaudí, es...",https://www.viajerosporelmundo.com/explora-el-mundo/el-parque-guell/
Circo de Gavarnie, Francia | Altos Pirineos de Francia - Hautes-Pyrénées,"El circo de Gavarnie es una maravilla del mundo. Con una de las cascadas más altas de Europa,...",https://www.viajerosporelmundo.com/explora-el-mundo/circo-de-gavarnie/
La Catedral y la Capilla Real, España | Granada,"Un monumento que debes visitar si vas a Granada es su Catedral, en el centro de la ciudad, una...",https://www.viajerosporelmundo.com/explora-el-mundo/catedral-capilla-real/
Los Museos Vaticanos, Italia | Roma,Los museos vaticanos tienen más de 6 millones de visitantes anuales. Son una de las principales...,https://www.viajerosporelmundo.com/explora-el-mundo/los-museos-vaticanos/
Barrio Rojo, Países Bajos | Ámsterdam,En el corazón de Ámsterdam hay un barrio que se ve desde lejos por sus neones y luces de color...,https://www.viajerosporelmundo.com/explora-el-mundo/barrio-rojo/
HMS Belfast, Inglaterra | Londres,El buque HMS Belfast es un museo flotante que podemos encontrar anclado en el río Támesis. Es...,https://www.viajerosporelmundo.com/explora-el-mundo/hms-belfast/
Castillo Condal, Francia | Carcasona,"Parada obligada si visitáis Carcasona es el Castillo Condal, construido en el siglo XII como...",https://www.viajerosporelmundo.com/explora-el-mundo/castillo-condal/
Circo de Tromouse, Francia | Altos Pirineos de Francia - Hautes-Pyrénées,"Situado en el Parque Nacional de los Pirineos , a unos 2.100 metros sobre el nivel del mar, el...",https://www.viajerosporelmundo.com/explora-el-mundo/circo-de-tromouse/
Puerta del Puente, España | Córdoba,Creada desde la época romana y usada durante la invasión musulmana la Puerta del Puente fue...,https://www.viajerosporelmundo.com/explora-el-mundo/puerta-del-puente/
Plaza de San Marcos, Italia | Venecia,La Plaza de San Marcos está situada en pleno corazón de Venecia. En ella están todos los...,https://www.viajerosporelmundo.com/explora-el-mundo/plaza-de-san-marcos/
La Puerta de Alcalá, España | Madrid,La puerta de Alcalá es un monumento emblemático de la ciudad de Madrid. Hace algunos años...,https://www.viajerosporelmundo.com/explora-el-mundo/la-puerta-de-alcala/
Catedral de Carcasona, Francia | Carcasona,La Catedral Saint-Michel de Carcasona es una iglesia de estilo gótico construida en el siglo...,https://www.viajerosporelmundo.com/explora-el-mundo/catedral-carcasona/
Galerías Saint Hubert, Bélgica | Bruselas,"Las Galerías Saint Hubert fueron diseñadas en el año 1847, siendo las primeras galerías...",https://www.viajerosporelmundo.com/explora-el-mundo/galerias-saint-hubert/
Plaza de la Corredera, España | Córdoba,La plaza de la Corredera es la única plaza mayor rectangular de toda Andalucía y uno de los...,https://www.viajerosporelmundo.com/explora-el-mundo/plaza-de-la-corredera/
La Plaza de la Ciudad Vieja, República Checa | Praga,"La Plaza de la Ciudad Vieja es, desde la Edad Media, uno de los sitios más transitados y con...",https://www.viajerosporelmundo.com/explora-el-mundo/la-plaza-de-la-ciudad-vieja/
Museo del Louvre, Francia | París,"Junto con la Torre Eiffel y el Arco del Triunfo, el Museo del Louvre es uno de los atractivos...",https://www.viajerosporelmundo.com/explora-el-mundo/museo-del-louvre/
Catedral de San Pablo, Inglaterra | Londres,"La Catedral de San Pablo tiene una altura de 110 metros, lo que la convierte en la segunda...",https://www.viajerosporelmundo.com/explora-el-mundo/catedral-de-san-pablo/
Museo de Historia natural, Inglaterra | Londres,El Museo de Historia Natural londinense es uno de los tres museos que se hallan situados en la...,https://www.viajerosporelmundo.com/explora-el-mundo/museo-de-historia-natural/
Coffe shops, Países Bajos | Ámsterdam,"Ámsterdam es mundialmente conocida por sus canales, sus bicis, sus museos… pero también por...",https://www.viajerosporelmundo.com/explora-el-mundo/coffe-shops/
Domancy, Francia,"Ocupando un lugar privilegiado en el corazón de la comarca del Mont Blanc, esta comuna francesa...",https://www.viajerosporelmundo.com/explora-el-mundo/domancy/
Alexanderpratz, Alemania | Berlín,Esta plaza está situada entre las calles Karl-Liebknechtstrasse (continuación hacia el este de...,https://www.viajerosporelmundo.com/explora-el-mundo/alexanderpratz/
Parque de la Ciutadella, España | Barcelona,Construido sobre los terrenos de la antigua fortaleza de la ciudad con motivo de la Exposición...,https://www.viajerosporelmundo.com/explora-el-mundo/parque-de-la-ciutadella/
Torre de la Pólvora, República Checa | Praga,"La Torre de la Pólvora (Prašná brána) es una de las torres más famosas de Praga,...",https://www.viajerosporelmundo.com/explora-el-mundo/torre-de-la-polvora/
Plaza de San Marcos, Italia | Venecia,La Plaza de San Marcos está situada en pleno corazón de Venecia. En ella están todos los...,https://www.viajerosporelmundo.com/explora-el-mundo/plaza-de-san-marcos/
La Catedral y la Capilla Real, España | Granada,"Un monumento que debes visitar si vas a Granada es su Catedral, en el centro de la ciudad, una...",https://www.viajerosporelmundo.com/explora-el-mundo/catedral-capilla-real/
HMS Belfast, Inglaterra | Londres,El buque HMS Belfast es un museo flotante que podemos encontrar anclado en el río Támesis. Es...,https://www.viajerosporelmundo.com/explora-el-mundo/hms-belfast/
Basílica de San Marcos, Italia | Venecia,La Basílica de San Marcos es el centro religioso más importante de Venecia. Situado junto al...,https://www.viajerosporelmundo.com/explora-el-mundo/basilica-de-san-marcos/
Museo del Pérgamo, Alemania | Berlín,Se trata de un museo que se ganó la fama mundial por albergar algunas de las grandes joyas...,https://www.viajerosporelmundo.com/explora-el-mundo/museo-del-pergamo/
Calleja de la Flores, España | Córdoba,"Ubicada en pleno corazón de Córdoba, la Calleja de la Flores se ha convertido en una visita...",https://www.viajerosporelmundo.com/explora-el-mundo/calleja-de-la-flores/
Basílica de San Pedro, Italia | Roma,La Basílica de San Pedro es el edificio religioso más importante del catolicismo. En ella el...,https://www.viajerosporelmundo.com/explora-el-mundo/basilica-de-san-pedro/
Ágora Antigua de Atenas, Grecia | Atenas,"El Ágora Antigua de Atenas era donde confluía la vida social, política y comercial de la...",https://www.viajerosporelmundo.com/explora-el-mundo/agora-antigua-de-atenas/
La Puerta del Sol, España | Madrid,"La Puerta del sol es una de las plazas más famosas de Madrid, y en ella se pueden encontrar...",https://www.viajerosporelmundo.com/explora-el-mundo/la-puerta-del-sol/
Palacio y Parque del Cincuentenario, Bélgica | Bruselas,"El Palacio del Cincuentenario es un impresionante monumento, que junto al Parque del...",https://www.viajerosporelmundo.com/explora-el-mundo/palacio-y-parque-del-cincuentenario/
Paseo de los Tristes, España | Granada,"Serpenteante entre la Alhambra y el Albaicín y bordeando los márgenes del río Darro, nos...",https://www.viajerosporelmundo.com/explora-el-mundo/paseo-tristes/
Museo de Bellas Artes de Granada, España | Granada,El Museo de Bellas Artes de Granada es la pinacoteca más importante de la ciudad y cuenta con...,https://www.viajerosporelmundo.com/explora-el-mundo/museo-bellas-artes-granada/
Plaza de las Tendillas, España | Córdoba,La Plaza de las Tendillas es el corazón de la ciudad de Córdoba y es el eje donde se...,https://www.viajerosporelmundo.com/explora-el-mundo/plaza-de-las-tendillas/
El Big Beng, Inglaterra | Londres,"El conocido reloj de la Torre del Reloj, en el Palacio de Westminster, se ha ido convirtiendo en...",https://www.viajerosporelmundo.com/explora-el-mundo/el-big-beng/
La Calleja del Pañuelo, España | Córdoba,"Una de las muchas callejas que encierran el encanto de Córdoba, la Calleja del Pañuelo es...",https://www.viajerosporelmundo.com/explora-el-mundo/la-calleja-del-panuelo/
Plaza Sintagma, Grecia | Atenas,"La Plaza Sintagma es el corazón de Atenas, en ella preside el Parlamento, que fue originalmente...",https://www.viajerosporelmundo.com/explora-el-mundo/plaza-sintagma/
Reloj Astronómico., República Checa | Praga,El Reloj Astronómico de Praga es un famoso reloj que podemos encontrar en la pared sur del...,https://www.viajerosporelmundo.com/explora-el-mundo/reloj-astronomico/
Campanile, Italia | Venecia,El Campanile es el edificio más alto de toda Venecia con sus casi 100 metros de altura. Situado...,https://www.viajerosporelmundo.com/explora-el-mundo/campanile/
Carrera del Darro y Plaza Nueva, España | Granada,"La Carrera del Darro, considerado uno de los rincones con más encanto de Granada, es uno de los...",https://www.viajerosporelmundo.com/explora-el-mundo/carrera-darro-plaza-nueva/
Glaciar de Bossons, Francia,"En la cima del Mont Blanc, en un marco natural incomparable, nace un glaciar cuya lengua de...",https://www.viajerosporelmundo.com/explora-el-mundo/glaciar-bossons/
Lago de Estaing, Francia | Altos Pirineos de Francia - Hautes-Pyrénées,El lago de Estaing es un lago natural a 1161 metros sobre el nivel del mar que de repente...,https://www.viajerosporelmundo.com/explora-el-mundo/lago-de-estaing/
Federal Hall, EEUU | Nueva York,"Muy cercano a Wall Street, el Federal Hall bien merece una visita. Este monumento destaca por...",https://www.viajerosporelmundo.com/explora-el-mundo/federal-hall/
Casa de Ana Frank, Países Bajos | Ámsterdam,La Casa de Ana Frank es uno de los lugares más representativos de Ámsterdam. En ella vivieron...,https://www.viajerosporelmundo.com/explora-el-mundo/casa-de-ana-frank/
Ágora Antigua de Atenas, Grecia | Atenas,"El Ágora Antigua de Atenas era donde confluía la vida social, política y comercial de la...",https://www.viajerosporelmundo.com/explora-el-mundo/agora-antigua-de-atenas/
Circo de Tromouse, Francia | Altos Pirineos de Francia - Hautes-Pyrénées,"Situado en el Parque Nacional de los Pirineos , a unos 2.100 metros sobre el nivel del mar, el...",https://www.viajerosporelmundo.com/explora-el-mundo/circo-de-tromouse/
Museo Británico, Inglaterra | Londres,"El Museo Británico es uno de los museos más famosos del mundo, no sólo por ser uno de los...",https://www.viajerosporelmundo.com/explora-el-mundo/museo-britanico/
Clementinum, República Checa | Praga,"El Clementinum (Klementinum en checo) es, después del Castillo de Praga, el complejo más...",https://www.viajerosporelmundo.com/explora-el-mundo/clementinum/
Museo de Bellas Artes de Granada, España | Granada,El Museo de Bellas Artes de Granada es la pinacoteca más importante de la ciudad y cuenta con...,https://www.viajerosporelmundo.com/explora-el-mundo/museo-bellas-artes-granada/
Estadio Panatenaico, Grecia | Atenas,"El Estadio Panatenaico, o Kalimármaro, fue construido originalmente entre el 330 y el 329 a.C....",https://www.viajerosporelmundo.com/explora-el-mundo/estadio-panatenaico/
London Eye, Inglaterra | Londres,"Ojo de Londres es una noria que sirve como mirador, con una altura que llega a los 135...",https://www.viajerosporelmundo.com/explora-el-mundo/london-eye/
Palacio Kensington, Inglaterra | Londres,"En Palacio de Kensington, en Londres, es la residencia habitual del Príncipe Guillermo, la...",https://www.viajerosporelmundo.com/explora-el-mundo/palacio-kensington/
Panteón de París, Francia | París,El panteón París fue el primer monumento de importancia de la capital francesa.  Su...,https://www.viajerosporelmundo.com/explora-el-mundo/panteon-de-paris/
Catedral de Carcasona, Francia | Carcasona,La Catedral Saint-Michel de Carcasona es una iglesia de estilo gótico construida en el siglo...,https://www.viajerosporelmundo.com/explora-el-mundo/catedral-carcasona/
Templo Romano, España | Córdoba,El Templo Romano está situado en la confluencia de la calle Claudio Marcelo con Calle...,https://www.viajerosporelmundo.com/explora-el-mundo/templo-romano/
The National Gallery, Inglaterra | Londres,"El principal museo de arte londinense está ubicado en la parte norte de Trafalgar Square,...",https://www.viajerosporelmundo.com/explora-el-mundo/the-national-gallery/
El Mirador de San Nicolás, España | Granada,"Hablar del Mirador de San Nicolás es hablar de “la puesta de sol más bonita del mundo”,...",https://www.viajerosporelmundo.com/explora-el-mundo/mirador-san-nicolas/
Palacio Real de Madrid, España | Madrid,El Palacio Real de Madrid es la residencia oficial de la Familia Real Española. Hoy en día el...,https://www.viajerosporelmundo.com/explora-el-mundo/palacio-real-de-madrid/
Las catacumbas de Roma, Italia | Roma,"Visitar las catacumbas supone emprender un viaje a través de una Roma subterránea.
En el...",https://www.viajerosporelmundo.com/explora-el-mundo/las-catacumbas-de-roma/
Puente Rialto y Mercado Rialto, Italia | Venecia,"El Puente Rialto es el más antiguo y famoso de Venecia. Y no sólo por su diseño, sino...",https://www.viajerosporelmundo.com/explora-el-mundo/puente-rialto-y-mercado-rialto/
El Muro de Berlín, Alemania | Berlín,Muro que dividió a la ciudad en dos partes durante 28 años. Muro que ha formado parte en los...,https://www.viajerosporelmundo.com/explora-el-mundo/el-muro-de-berlin/
Reloj Astronómico., República Checa | Praga,El Reloj Astronómico de Praga es un famoso reloj que podemos encontrar en la pared sur del...,https://www.viajerosporelmundo.com/explora-el-mundo/reloj-astronomico/
